{
  "$schema": "https://json-schema.org/draft/2020-12/schema",
  "$id": "https://vela.science/schemas/canopus.public-run.v1.json",
  "title": "Canopus Public Run v1",
  "type": "object",
  "additionalProperties": false,
  "required": [
    "schema",
    "authority",
    "run_id",
    "mission",
    "activity",
    "claim",
    "caveats",
    "artifact_roots",
    "verifier_root",
    "receipt_root",
    "policy",
    "usage",
    "source",
    "final",
    "reproduction",
    "nonclaims"
  ],
  "properties": {
    "schema": { "const": "canopus.public-run.v1" },
    "authority": { "const": "read_only_projection" },
    "run_id": { "type": "string", "minLength": 5, "maxLength": 128 },
    "mission": {
      "type": "object",
      "additionalProperties": false,
      "required": ["id", "target", "digest", "registration_kind", "registration_name", "registration_root", "target_packet_root", "model"],
      "properties": {
        "id": { "type": "string" },
        "target": { "type": "string" },
        "digest": { "$ref": "#/$defs/sha256" },
        "registration_kind": { "type": "string", "enum": ["profile", "mission_bundle"] },
        "registration_name": { "type": "string" },
        "registration_root": { "$ref": "#/$defs/sha256" },
        "target_packet_root": { "$ref": "#/$defs/sha256" },
        "model": { "type": "string" }
      }
    },
    "activity": {
      "type": "object",
      "additionalProperties": false,
      "required": ["worker", "verifier", "clean_clone_replay"],
      "properties": {
        "worker": { "const": "success" },
        "verifier": { "const": "pass" },
        "clean_clone_replay": { "const": "matched" }
      }
    },
    "claim": { "type": "string", "minLength": 1 },
    "caveats": { "type": "array", "items": { "type": "string" } },
    "artifact_roots": { "type": "array", "minItems": 1, "maxItems": 10, "items": { "$ref": "#/$defs/sha256" } },
    "verifier_root": { "$ref": "#/$defs/sha256" },
    "receipt_root": { "$ref": "#/$defs/sha256" },
    "policy": {
      "type": "object",
      "additionalProperties": false,
      "required": ["route", "proposal_id", "accepted_state_delta"],
      "properties": {
        "route": { "const": "defer" },
        "proposal_id": { "type": "string" },
        "accepted_state_delta": { "const": 0 }
      }
    },
    "usage": {
      "type": "object",
      "additionalProperties": false,
      "required": ["research_elapsed_ms", "research_processes", "observed_tokens", "attempts"],
      "properties": {
        "research_elapsed_ms": { "type": "integer", "minimum": 0 },
        "research_processes": { "type": "integer", "minimum": 0 },
        "observed_tokens": { "type": "integer", "minimum": 0 },
        "attempts": { "type": "integer", "minimum": 0 }
      }
    },
    "source": { "$ref": "#/$defs/state" },
    "final": {
      "type": "object",
      "additionalProperties": false,
      "required": ["commit", "event_log_root", "snapshot_root"],
      "properties": {
        "commit": { "$ref": "#/$defs/git" },
        "event_log_root": { "$ref": "#/$defs/sha256" },
        "snapshot_root": { "$ref": "#/$defs/sha256" }
      }
    },
    "reproduction": {
      "type": "object",
      "additionalProperties": false,
      "required": ["commands"],
      "properties": {
        "commands": { "type": "array", "minItems": 4, "maxItems": 4, "items": { "type": "string" } }
      }
    },
    "nonclaims": { "type": "array", "minItems": 3, "items": { "type": "string" } }
  },
  "$defs": {
    "sha256": { "type": "string", "pattern": "^sha256:[0-9a-f]{64}$" },
    "git": { "type": "string", "pattern": "^[0-9a-f]{40,64}$" },
    "state": {
      "type": "object",
      "additionalProperties": false,
      "required": ["repository", "commit", "event_log_root", "snapshot_root"],
      "properties": {
        "repository": { "type": "string", "pattern": "^https://github\\.com/vela-science/[a-z0-9-]+$" },
        "commit": { "$ref": "#/$defs/git" },
        "event_log_root": { "$ref": "#/$defs/sha256" },
        "snapshot_root": { "$ref": "#/$defs/sha256" }
      }
    }
  }
}
