{"activity":{"clean_clone_replay":"matched","verifier":"pass","worker":"success"},"artifact_roots":["sha256:0547b0dba763c44b7c29f25407c66c3fe378ad64e164713d9c40a2caab96b088","sha256:23938294de90988480724d89405e8e97e8c9427ec647ea1a6e67aed877df6d9b","sha256:a16d74ae1bbde4d126afd57f5217e023f528bd754f62c6b7d5e86a58e7787c88"],"authority":"read_only_projection","caveats":["The worker handed off without verifier authority; Canopus subsequently recorded the separate verifier outcome.","Declared verifier outcome: passed.","Canopus produced this record; it is not a human acceptance decision."],"claim":"Bounded exhaustive search completed for Erdős 1056 k=15 over primes in 10428601..10428800; produced the required artifact bytes. Verification remains pending and will be performed separately by the frozen Canopus verifier.","final":{"commit":"e9ae9d3dd2ef5cae18346ee892451a091159f232","event_log_root":"sha256:b430f080ef0ac992571e0777b7154a8ae3567d0e9dd7292d3ee36e3ed2e4d8cd","snapshot_root":"sha256:ec16ec12124084e9ecbe3e954faa78bde52761673b2e3057dca0cd7f3a563280"},"mission":{"digest":"sha256:5d16a95366a5dce79dd3f1b1ea873349ca52e86c7caab8e015e9377e3385b2e0","id":"mission_erdos1056_k15_range_10428601_10428800_native2_retry","model":"gpt-5.4","registration_kind":"profile","registration_name":"erdos1056-k15-10428601-10428800","registration_root":"sha256:7225998d661b711786e194e2b578233f8d5f0cef129d4d06af7156ff90b51734","target":"erdos:1056","target_packet_root":"sha256:351cf94d7a6bfee8f8abd386af54f8bfa7fcc2cd01cf5cc155cf0a981086fcc5"},"nonclaims":["Verifier success is not scientific acceptance.","The bounded result does not establish maximality or settle the broader scientific problem.","Canopus did not sign or perform a human decision."],"policy":{"accepted_state_delta":0,"proposal_id":"vpr_a845ae60ed695b93","route":"defer"},"receipt_root":"sha256:7400662ed6493aa6dc49a31c0d2ea1099a5380a272914b13325aaf088ba58b57","reproduction":{"commands":["git clone https://github.com/vela-science/erdos-frontier.git","cd erdos-frontier","git checkout e9ae9d3dd2ef5cae18346ee892451a091159f232","vela reproduce 'artifacts/erdos1056-k15-range-10428601-10428800.txt'"]},"run_id":"run_192b3bef-9d6e-49e5-b72d-7ae903b29d5e","schema":"canopus.public-run.v1","source":{"commit":"7028ab2ad85f0fa2aee4526098e474044459e4e6","event_log_root":"sha256:12daf8cc1e4f2777629ca953e081c99b2931a60b8245273b9085a5c0add53c3b","repository":"https://github.com/vela-science/erdos-frontier","snapshot_root":"sha256:7f6efe7edd5bb0cf5e1fcb31d0b0d8892aa1de9a680dc4355d8628addcb546f4"},"usage":{"attempts":1,"observed_tokens":72454,"research_elapsed_ms":281331,"research_processes":7},"verifier_root":"sha256:7d6ac5bc88a1ca3d879c05e4429f237d017cdfc58f4c837d5d011a77c66fd46d"}
