{"activity":{"clean_clone_replay":"matched","verifier":"pass","worker":"success"},"artifact_roots":["sha256:143ce07733126239999e375f865aeeca36a17453df1de98a0afbef848c33066c","sha256:79370d5243095f28e65c218f3d5dc4710802e4dbe462fcfff1a35a8697a6f225","sha256:9fdad10b14ff7c267c418e1ced041810085974d52715d7d1c5b5f766d62f1df3"],"authority":"read_only_projection","caveats":["Declared verifier outcome: passed.","Canopus produced this record; it is not a human acceptance decision."],"claim":"Exhaustive registered search over primes in 10428401..10428600 completed with a bounded negative result; the maximum factorial-residue fiber multiplicity found was 12 at p=10428581, residue=5141590.","final":{"commit":"807f0a8f770cfed05ac0dff00b952dc41052a720","event_log_root":"sha256:a06797bc0d1b0e3c88a2f97507fe0832661e3992d8df41187a0aa6d3ceee9bde","snapshot_root":"sha256:1faedc24f040a60a22177b456c74b969a61ce8836082297b1835797a57b4fa56"},"mission":{"digest":"sha256:184719717253a80c7731dfa669c179698be50893d3b4abf88a1c0542bca1683d","id":"mission_erdos1056_k15_range_10428401_10428600_native1","model":"gpt-5.4","registration_kind":"mission_bundle","registration_name":"mission_erdos1056_k15_range_10428401_10428600_native1","registration_root":"sha256:184719717253a80c7731dfa669c179698be50893d3b4abf88a1c0542bca1683d","target":"erdos:1056","target_packet_root":"sha256:d724686d60ffbb61e5e24eab9084b34f1a797381bfb2731a2fa81e14d7ee652e"},"nonclaims":["Verifier success is not scientific acceptance.","The bounded result does not solve its general Erdős problem.","Canopus did not sign or perform a human decision."],"policy":{"accepted_state_delta":0,"proposal_id":"vpr_501cbeec70cd719c","route":"defer"},"receipt_root":"sha256:263506aae0144fb2aa4784ff9c145c6c41886b2956191c6458214cedd0bfd4aa","reproduction":{"commands":["git clone https://github.com/vela-science/erdos-frontier.git","cd erdos-frontier","git checkout 807f0a8f770cfed05ac0dff00b952dc41052a720","vela reproduce ."]},"run_id":"run_eb6bcd46-cffd-4ae8-b630-2681bd84da71","schema":"canopus.public-run.v1","source":{"commit":"fde5e1da5816445e3f7a71f3d5a3cc3167b0b2c0","event_log_root":"sha256:1e88846f042451428d4aeade2f26d45253db9db669aab9a28bba1a4e95d6c8b8","repository":"https://github.com/vela-science/erdos-frontier","snapshot_root":"sha256:2c8318dc84ec44240018b272a5bb2f99bc4479a378a9a5a50f0b78f2c19e772f"},"usage":{"attempts":1,"observed_tokens":50442,"research_elapsed_ms":94770,"research_processes":7},"verifier_root":"sha256:6d3f61b9111fde87d57340404ad5b7561a4aa777ce54c8bf639d081c216cb165"}
