{"activity":{"clean_clone_replay":"matched","verifier":"pass","worker":"success"},"artifact_roots":["sha256:5eca82c582a9d3b6ae63d137cf7dadd4a01e40d52bc1bfac99932d1d8752f884","sha256:878b05e01dbc4a785e5a671f977509f0bb338dfcb58ac53bf03d47bf6465f01e","sha256:ba5da48c4f6fd744a70eb82d5e1a8291f981bf5ee4df9ec2d86d8184fde22de3"],"authority":"read_only_projection","caveats":["The worker handed off without verifier authority; Canopus subsequently recorded the separate verifier pass shown in this projection.","Declared verifier outcome: passed.","Canopus produced this record; it is not a human acceptance decision."],"claim":"Produced the exact reconstructed 7,194-point Sidon witness for {0,1}^24.","final":{"commit":"4289e05876f142e72af622672e190be26f6a6f1d","event_log_root":"sha256:11a668d1cdd9caa18f6c3c78ac8c03431bd2ab9beb71f3c62c747d8a7b6571cd","snapshot_root":"sha256:0441baf3d3c0f7f58e51d8d0b54d2e20ee94c57cfe3fd52ec0ea6dde2ee0c92d"},"mission":{"digest":"sha256:611dc75d2dce98b218deeaf68985dec961a0722446fe1d2879447997ffcfa2ba","id":"mission_sidon_a24_at_least_7194_gpt56_v3","model":"gpt-5.6-sol","registration_kind":"profile","registration_name":"sidon-a24-at-least-7194-gpt56-v3","registration_root":"sha256:3b529df4304b96890cdd7eed5f90fd862422b8b1e7b4da1cef0a478e6e7cdebe","target":"sidon:a24-improve","target_packet_root":"sha256:09977a08357cbe240c5a7f5c3ea8e5c7055d6b5d71bcfb5f947b49accee1a3a8"},"nonclaims":["Verifier success is not scientific acceptance.","The bounded result does not establish maximality or settle the broader scientific problem.","Canopus did not sign or perform a human decision."],"policy":{"accepted_state_delta":0,"proposal_id":"vpr_491cc97cfdfe98ff","route":"defer"},"receipt_root":"sha256:91b9f0c72e2934d3f98a34de93b61a168c8a9ff560a18a63ff4a1ee6ae2f897c","reproduction":{"commands":["git clone https://github.com/vela-science/sidon-frontier.git","cd sidon-frontier","git checkout 4289e05876f142e72af622672e190be26f6a6f1d","vela reproduce ."]},"run_id":"run_f68e4cfc-e5c7-4c73-86cb-d79807c47ec4","schema":"canopus.public-run.v1","source":{"commit":"6f9dca7e30ea3d9db3f440fcb4b50ece21dcf40e","event_log_root":"sha256:f063218142b0995179f751036108c94e7f368eb257be31e6807a36121f7a13aa","repository":"https://github.com/vela-science/sidon-frontier","snapshot_root":"sha256:fe5498193ab1079696af6de6f8a899334908a247fd78f7a25fb476b5b36b43b8"},"usage":{"attempts":1,"observed_tokens":105553,"research_elapsed_ms":88131,"research_processes":7},"verifier_root":"sha256:89130864b3ca4f354673416d4352616265b1e3dc25147a4ae91bbbf3874fbff8"}
